{
  "$schema": "https://json-schema.org/draft/2020-12/schema",
  "title": "AI_KV AI Development State",
  "type": "object",
  "required": [
    "schemaVersion",
    "project",
    "currentPhase",
    "currentTask",
    "repository",
    "qualityGates",
    "lastUpdated"
  ],
  "properties": {
    "schemaVersion": {
      "type": "integer",
      "const": 1
    },
    "project": {
      "type": "string",
      "const": "AI_KV"
    },
    "currentPhase": {
      "type": "string",
      "pattern": "^P[0-9]{2}$"
    },
    "currentTask": {
      "type": [
        "string",
        "null"
      ],
      "pattern": "^P[0-9]{2}-W[0-9]{3}$"
    },
    "repository": {
      "type": "object",
      "required": [
        "branch",
        "head",
        "dirty"
      ],
      "properties": {
        "branch": {
          "type": "string"
        },
        "head": {
          "type": "string"
        },
        "dirty": {
          "type": "boolean"
        },
        "uncommittedFiles": {
          "type": "array",
          "items": {
            "type": "string"
          }
        }
      }
    },
    "qualityGates": {
      "type": "object",
      "properties": {
        "build": {
          "enum": [
            "unknown",
            "pass",
            "fail"
          ]
        },
        "unitTests": {
          "enum": [
            "unknown",
            "pass",
            "fail"
          ]
        },
        "integrationTests": {
          "enum": [
            "unknown",
            "pass",
            "fail"
          ]
        },
        "securityTests": {
          "enum": [
            "unknown",
            "pass",
            "fail"
          ]
        },
        "format": {
          "enum": [
            "unknown",
            "pass",
            "fail"
          ]
        }
      }
    },
    "decisions": {
      "type": "array",
      "items": {
        "type": "string"
      }
    },
    "risks": {
      "type": "array",
      "items": {
        "type": "string"
      }
    },
    "blockers": {
      "type": "array",
      "items": {
        "type": "string"
      }
    },
    "nextActions": {
      "type": "array",
      "items": {
        "type": "string"
      }
    },
    "lastUpdated": {
      "type": "string",
      "format": "date-time"
    }
  },
  "additionalProperties": false
}