{
  "schemaVersion": 1,
  "project": "AI_KV",
  "currentPhase": "P04",
  "currentTask": null,
  "repository": {
    "branch": "main",
    "head": "",
    "dirty": false,
    "uncommittedFiles": []
  },
  "qualityGates": {
    "build": "pass",
    "unitTests": "pass",
    "integrationTests": "unknown",
    "securityTests": "unknown",
    "format": "pass"
  },
  "decisions": [
    "使用 .NET 9 + C# latest",
    "强类型标识符使用 record + StrongId 基类",
    "Context Package Manifest/Payload 分离，JSON Schema v1 冻结",
    "CapabilityFlags 序列化为 enabled 列表",
    "CI 使用 GitHub Actions",
    "SQLite 连接禁用连接池以支持跨平台文件管理",
    "应用数据目录全部位于 AI_KV 数据目录，不写入用户源码",
    "FTS5 使用 unicode61 分词器",
    "ripgrep 封装支持降级到进程内文本搜索",
    "文件监听事件去抖 + 溢出检测 + 对账最终确认",
    "索引快照原子切换：Building → Active → Superseded",
    "Parser 使用 [GeneratedRegex] 源生成器，类需 partial 修饰",
    "C#/TypeScript/Python 三语言 Regex 解析器 + 启发式关系标记",
    "Repo Map 预算受限，优先展示 class/interface/function",
    "ParserCache 按文件哈希+Parser版本缓存"
  ],
  "risks": [
    "许可证未正式确定（LICENSE 占位）",
    "Tree-sitter 原生库打包策略待后续确定（当前用 Regex 替代）",
    "P02-W012 性能基准尚未建立"
  ],
  "blockers": [],
  "nextActions": [
    "开始 P04-W001: 实现任务解析器",
    "开始 P04-W002: 实现候选召回管线"
  ],
  "lastUpdated": "2026-08-06T18:15:00Z"
}